record_id,title,year,search_source,screen_decision_codex,screen_decision_gemini,screen_confidence_codex,screen_confidence_gemini,exclude_code_codex,exclude_code_gemini,rationale_codex,rationale_gemini,screen_consensus,oauth_auth_method_codex,oauth_auth_method_gemini,human1_decision,human2_decision,adjudicated_final_decision,exclude_code,decision_rationale,adjudicator_id
REC_06208,"m-Health: A Critical Analysis of Awareness, Perception, and Attitude of Healthcare Among Providers in Himachal Pradesh, North India",2016,WoS,exclude,exclude,0.93,0.95,E2,E2,"This is a quantitative survey of healthcare providers’ awareness/attitudes toward m-health, but the focal technology is mobile health/telemedicine rather than AI. It is also not situated in an educational adoption context (students/instructors/administrators as education actors), so it does not fit the meta-analysis scope.","The study focuses on m-health adoption among healthcare providers, not AI technology. Additionally, the context is healthcare delivery, not an educational setting.",exclude,oauth,oauth,,,,,,
REC_06322,Leadership Training in Medicine-12 Years of Experience From the Feagin Leadership Program,2023,WoS; Scopus; PsycINFO,exclude,exclude,0.99,1.0,E2,E2,"This study evaluates a medical leadership training program, not adoption/acceptance/use of an AI technology. Although it is a quantitative survey in an educational trainee context, it does not match the AI-focused adoption meta-analysis target.","The study focuses on leadership training in medicine and does not mention or involve AI technology. It also only reports descriptive statistics, not correlation or path data required for meta-analysis.",exclude,oauth,oauth,,,,,,
REC_06411,Assessment of Ileostomy Output Using Telemedicine: A Feasibility Trial,2018,WoS; Scopus,exclude,exclude,0.99,1.0,E3,E2,"This is a quantitative clinical telemedicine feasibility trial in postoperative ileostomy care, not an educational setting or population. AI is not the focal technology, and the study does not report adoption-model effect sizes such as correlation matrices or standardized beta/path coefficients.","This study focuses on telemedicine in a medical context, specifically for ileostomy patients, and does not involve AI technology or an educational setting.",exclude,oauth,oauth,,,,,,
REC_06528,Until you have something to lose! Loss aversion and two-factor authentication adoption,2025,WoS; Scopus,exclude,exclude,0.98,1.0,E2,E2,"This is a quantitative adoption study, but the focal technology is two-factor authentication rather than AI. The sample is a general population in Indonesia, not an educational setting/population.","The study is excluded because the focal technology is two-factor authentication (2FA), a security protocol, not an AI technology. Additionally, the study was conducted on a general population sample from Indonesia, not within an educational setting.",exclude,oauth,oauth,,,,,,
REC_06688,Assessing internship learning performance and its predictors: moderation of learning climate,2024,WoS; Scopus; PsycINFO,exclude,exclude,0.99,1.0,E2,E2,"This is an empirical survey of graduate students in internship contexts, but the focal constructs are learning performance, problem-solving efficacy, and learning climate rather than AI technology. It also does not measure AI adoption/acceptance/intention/use outcomes required for this meta-analysis.","The study focuses on general internship learning performance and its psychological predictors, with no mention of AI technology as a focal element of the research.",exclude,oauth,oauth,,,,,,
REC_06958,Exploring the drivers and consequences of the “awe” emotion in outdoor sports – a study using the latest partial least squares structural equation modeling technique and necessary condition analysis,2022,PsycINFO,exclude,exclude,0.99,1.0,E2,E2,"This is an empirical quantitative PLS-SEM study, but it examines awe, satisfaction, and behavioral intention in outdoor sports tourism rather than AI technology. It also does not involve an educational population or AI adoption/acceptance outcomes.",This study focuses on the emotion of 'awe' in outdoor sports. It does not examine AI technology (E2) and is not set in an educational context (E3).,exclude,oauth,oauth,,,,,,
REC_06975,Gaining legitimacy and host market acceptance: A CRM analysis for foreign subsidiaries in China,2023,PsycINFO,exclude,exclude,0.99,1.0,E2,E2,"This is a quantitative firm-level CRM/CSR study of foreign subsidiaries in China, not a study of AI technology. It is not set in an educational population and does not measure AI adoption/acceptance outcomes.","The study focuses on Cause-Related Marketing for foreign subsidiaries in China, not AI technology in an educational setting. AI is not focal to the research.",exclude,oauth,oauth,,,,,,
REC_07054,Exploring factors influencing educators' adoption of ChatGPT: a mixed method approach,2024,WoS; Scopus,include,include,0.96,1.0,NA,NA,This is an empirical mixed-method study with a clear quantitative component (PLS-SEM on 243 educator surveys) focused on ChatGPT adoption in higher education. It directly measures adoption intention/resistance and is very likely to report standardized path coefficients suitable for meta-analytic effect-size extraction.,"This empirical quantitative study uses SEM to examine factors influencing educators' intention to adopt ChatGPT within an educational context, published in 2024, and is likely to report effect sizes.",include,oauth,oauth,,,,,,
REC_07108,Attitude and behavioral intention for using metaverse in education: learner's perspective,2024,WoS; Scopus,exclude,exclude,0.84,0.95,E2,E2,"The study is a quantitative SEM analysis in a higher-education student sample and measures attitude/behavioral intention, with likely standardized path coefficients. However, the focal technology is the metaverse (XR platform), not AI specifically, so it does not meet the AI-focal inclusion criterion.","The study primarily investigates the adoption of 'metaverse' in an educational context, not artificial intelligence, failing the AI technology focal criterion.",exclude,oauth,oauth,,,,,,
REC_07155,How to use it more? Self-efficacy and its sources in the use of social media for knowledge sharing,2020,WoS; Scopus,exclude,exclude,0.97,1.0,E2,E2,"This is a quantitative university-based study on researchers’ social media self-efficacy and use, but the focal technology is social media rather than AI. It also appears to rely on descriptive statistics, with no clear indication of correlation matrices or standardized beta/path coefficients needed for meta-analytic effect sizes.","The study investigates the use of social media for knowledge sharing, not the adoption or use of AI technology. While it is quantitative and in an educational setting, the core focus is not AI.",exclude,oauth,oauth,,,,,,
REC_07159,Enterprising social media communities: how Instagram influencers shape Gen Z purchasing intentions in Middle-Eastern universities,2025,Scopus,exclude,exclude,0.99,1.0,E2,E2,"This is a quantitative SEM study with university students, but the focal technology is Instagram influencer marketing rather than AI. The outcome is consumer purchase intention, not adoption/acceptance/intention/use of AI in education.","The study focuses on social media influencer marketing and its impact on consumer purchase intentions. AI technology is not the focal subject of investigation, and the outcome measured is commercial, not related to the adoption of an educational tool.",exclude,oauth,oauth,,,,,,
REC_07606,Ethical Concerns With Regards to Artificial Intelligence: A National Public Poll in Taiwan,2024,IEEE,exclude,exclude,0.98,1.0,E3,E4,"This is a quantitative public-opinion poll on AI ethics in the general Taiwanese adult population, not an educational setting or education-specific sample. It also does not measure AI adoption/acceptance/intention/use outcomes required for the meta-analysis.","The study focuses on general public ethical concerns about AI, not on AI adoption or acceptance within an educational setting or population, and is unlikely to report effect sizes relevant for MASEM.",exclude,oauth,oauth,,,,,,
REC_07616,The Influence of Social Support Theory on AI Acceptance: Examining Educational Support and Perceived Usefulness Using SEM Analysis,2025,WoS; Scopus; IEEE,include,include,0.97,0.9,NA,NA,"This is an empirical quantitative survey study (n=308) in a higher-education setting using SEM, with AI acceptance/intention as focal outcomes. It reports standardized path coefficients (beta values), is in English, and falls within the 2015–2025 window (2025).","This empirical quantitative study uses SEM to examine AI acceptance in an educational setting, reporting beta coefficients. It clearly focuses on AI and adoption outcomes, and was published within the specified timeframe.",include,oauth,oauth,,,,,,
REC_07623,"Improving Learning Management System Performance: A Comprehensive Approach to Engagement, Trust, and Adaptive Learning",2025,WoS; IEEE,exclude,exclude,0.9,0.95,E2,E2,"The study is a quantitative SEM analysis in higher education and likely reports path coefficients, but its focal technology is LMS performance rather than an AI system. Adaptive learning is discussed as a feature, not as the primary AI adoption target.","The study focuses on Learning Management System (LMS) performance and adaptive learning, but AI technology is not explicitly mentioned as focal. The emphasis is on system quality, user satisfaction, and loyalty within LMS platforms.",exclude,oauth,oauth,,,,,,
REC_07676,Predicting Postgraduate Student Engagement Using Artificial Intelligence (AI),2025,Scopus; IEEE,exclude,exclude,0.94,0.9,E4,E5,"This is a quantitative educational AI study, but the outcome is student engagement prediction rather than AI adoption/acceptance/intention/use. It also reports ML performance metrics (e.g., accuracy, F1) rather than correlation matrices or standardized beta/path coefficients needed for meta-analytic effect sizes.","The study focuses on using AI to predict student engagement, not on the adoption or acceptance of AI technology by users. It also reports predictive performance metrics (e.g., accuracy) rather than correlation matrices or standardized path coefficients needed for meta-analytic structural equation modeling.",exclude,oauth,oauth,,,,,,
REC_07937,Stigma by association among alcohol and other drug and harm reduction workers: Implications for workplace outcomes,2024,PsycINFO,exclude,exclude,0.99,1.0,E2,E2,"This is a quantitative workplace stigma study in AOD/harm reduction workers, not a study of AI technology. It also does not involve an educational population or AI adoption/acceptance/use outcomes.","The study focuses on stigma among health workers in the AOD/harm reduction sector, not AI technology or an educational setting, and does not measure technology adoption outcomes.",exclude,oauth,oauth,,,,,,
REC_08230,Health empowerment among immigrant women in transnational marriages in Taiwan,2015,PsycINFO,exclude,exclude,0.99,1.0,E2,E2,"This study is a health empowerment intervention for immigrant women and does not examine AI technology, educational populations, or AI adoption/acceptance outcomes. The design appears primarily participatory action research with qualitative thematic outcomes, with no evident correlational/path effect-size reporting relevant to the meta-analysis.","The study does not involve AI technology, focus on an educational setting or population, or measure technology adoption/acceptance. The methodology appears qualitative or mixed-methods.",exclude,oauth,oauth,,,,,,
REC_08398,Community‐based multiple screening for metabolic syndrome by innovative theory: A longitudinal study,2022,PsycINFO,uncertain,exclude,0.0,1.0,NA,E2,codex timed out after 300s,"The study focuses on the adoption of a cancer screening program and metabolic syndrome, not AI technology. Additionally, the context is general public health, not an educational setting or population.",conflict,oauth,oauth,,,,,,
REC_08664,RETRACTED: Exploring the Entrepreneurship Training Mode of Medical Students in Beijing-Tianjin-Hebei Universities under the Strategic Background of Healthy China from the Perspective of Mixed Big Data (Retracted Article),2022,WoS; Scopus,exclude,exclude,0.98,1.0,E2,E2,"This is a quantitative survey in an education population, but the focal construct is entrepreneurial intention, not adoption/acceptance/use of an AI technology. The article is also marked as retracted, further supporting exclusion.","The study focuses on entrepreneurial intention, not the adoption of AI technology. Despite mentioning 'mixed big data', the core research is about factors influencing entrepreneurship among medical students using the TPB model.",exclude,oauth,oauth,,,,,,
REC_08829,"Exploring relationships between K–12 music educators’ demographics, perceptions of intrapreneuring, and motivation at work",2017,PsycINFO,exclude,exclude,0.98,1.0,E2,E2,"This is an empirical quantitative study in an educational population, but the focal construct is intrapreneuring and teacher motivation, not AI technology. It also does not measure AI adoption/acceptance/intention/use outcomes required for this meta-analysis.","The study investigates intrapreneurship and motivation in music educators. It does not concern AI technology, which is a primary inclusion criterion.",exclude,oauth,oauth,,,,,,
REC_08876,"Using factorial survey experiments to measure attitudes, social norms, and fairness concerns in developing countries",2020,PsycINFO,exclude,exclude,0.99,1.0,E2,E2,"This is a methodological paper on factorial survey experiments with applications to social norms/fairness and general technology adoption, not AI-specific adoption. The described studies are not situated in an educational population or setting.",The study discusses general technology adoption and social norms in developing countries using survey experiments. It does not focus on AI technology and lacks an educational context.,exclude,oauth,oauth,,,,,,
REC_08934,Predictors of maternal parental self-efficacy among primiparas in the early postnatal period,2015,PsycINFO,exclude,exclude,0.99,1.0,E2,E2,"This is a quantitative maternal health study on parental self-efficacy, social support, and postnatal depression, not an AI-focused study. It is also outside an educational setting and does not measure AI adoption/acceptance/use outcomes.","This study focuses on maternal parental self-efficacy and postnatal depression, lacking any mention of AI technology or an educational context. Therefore, it does not meet the core criteria for AI adoption in education.",exclude,oauth,oauth,,,,,,
REC_08948,The influence of learning value on learning management system use: An extension of UTAUT2,2016,WoS; Scopus,exclude,exclude,0.97,1.0,E2,E2,"This is a quantitative educational technology adoption study (UTAUT2 on LMS intention/use) with likely SEM path coefficients, but the focal technology is an LMS rather than AI. Therefore it does not meet the AI-focal inclusion criterion.",The study focuses on the adoption of Learning Management Systems (LMS) and does not explicitly mention or focus on Artificial Intelligence technology.,exclude,oauth,oauth,,,,,,
REC_09025,Assessing teacher wellness: Confirmatory factor analysis and measurement invariance of the Teacher Subjective Wellbeing Questionnaire,2018,PsycINFO,exclude,exclude,0.99,1.0,E2,E2,"This is a quantitative psychometric validation study of teacher subjective wellbeing (TSWQ) in schools, not a study of AI technology. It does not measure AI adoption/acceptance/use outcomes or provide adoption-related effect sizes for an AI adoption meta-analysis.","This study focuses on teacher well-being and psychological functioning, not on the adoption or use of AI technology in an educational context.",exclude,oauth,oauth,,,,,,
REC_09138,Ethical climate and nurse competence—Newly graduated nurses' perceptions,2015,PsycINFO,exclude,exclude,0.99,1.0,E2,E2,"This is a quantitative correlational nursing workforce study, but it does not focus on AI technology or an educational adoption context. Outcomes are ethical climate, competence, turnover intentions, and job satisfaction rather than AI adoption/acceptance/intention/use.","The study focuses on the ethical climate and competence of newly graduated nurses, with no mention of AI technology or its adoption. It is also not set in an educational context for learning AI.",exclude,oauth,oauth,,,,,,
REC_09394,School counselors’ emotional intelligence and its relationship to leadership,2017,PsycINFO,exclude,exclude,0.98,1.0,E2,E2,"This study is about emotional intelligence and leadership among school counselors, not AI technology. It also does not measure AI adoption/acceptance/intention/use outcomes required for the meta-analysis.","The study focuses on emotional intelligence and leadership in school counselors, with no mention of AI technology. It does not measure adoption or acceptance of technology.",exclude,oauth,oauth,,,,,,
REC_09519,"Assessing evolutionary theory knowledge performance among Brazilian undergraduates: exploring political and religious affiliation differences and gender, ethnicity, and socioeconomic inequalities",2025,Scopus,uncertain,exclude,0.0,1.0,NA,E2,codex timed out after 300s,The study focuses on Evolutionary Theory knowledge and does not mention AI technology. It also measures knowledge performance rather than technology adoption or acceptance.,conflict,oauth,oauth,,,,,,
REC_09607,"Psychiatrists’ and trainees’ knowledge, perception, and readiness for integration of artificial intelligence in mental health care in Nigeria",2025,Scopus,exclude,exclude,0.93,0.95,E3,E3,"This is a quantitative AI adoption-readiness survey, but the population is psychiatrists/clinical trainees in healthcare practice rather than an educational setting (students, instructors, or administrators). The abstract reports descriptive percentages and does not indicate correlation matrices or standardized beta/path coefficients.","The study population consists of psychiatrists and trainees in a professional healthcare context, not an educational one. Additionally, the descriptive survey design makes it highly improbable that it contains the correlation or path coefficient data required for the meta-analysis.",exclude,oauth,oauth,,,,,,
REC_09766,Cooking with the curriculum: a pilot culinary medicine program at the Larner College of Medicine,2025,WoS; Scopus,exclude,exclude,0.99,1.0,E2,E2,"This is a quantitative educational pilot in medical students, but it focuses on culinary medicine/nutrition training rather than AI technology. It also does not report AI adoption/acceptance outcomes or effect-size data (e.g., correlation matrix or standardized beta/path coefficients) relevant to an AI adoption meta-analysis.","The study focuses on culinary medicine and nutrition education, not on AI technology. Therefore, it does not meet the criterion for AI technology being focal.",exclude,oauth,oauth,,,,,,
REC_10009,Professional quality of life profiles and its associations with turnover intention and life satisfaction among nurses: A prospective longitudinal study,2024,PsycINFO,exclude,exclude,0.99,0.95,E2,E2,"This is a quantitative nursing workforce study on professional quality of life, turnover intention, and life satisfaction, not on AI technology. The population and setting are healthcare (nurses in a hospital), not educational, and no AI adoption/acceptance/use outcome is measured.","The study focuses on the professional quality of life among nurses and their turnover intention, with no mention of AI technology or an educational setting.",exclude,oauth,oauth,,,,,,
REC_10047,How mental health status and attitudes toward mental health shape AI Acceptance in psychosocial care: A cross-sectional analysis,2025,PsycINFO,exclude,exclude,0.91,0.9,E3,E3,"This is a quantitative cross-sectional study focused on AI acceptance/use variables and likely reports regression effect sizes. However, the sample is a general psychosocial-care population rather than an educational setting/population (students, instructors, or administrators).","The study focuses on AI acceptance in psychosocial care, not within an educational setting or population. This directly violates criterion 3.",exclude,oauth,oauth,,,,,,
REC_10123,Roles of perceived fit and perceived individual learning support in students' weblogs continuance usage intention,2018,WoS; Scopus,exclude,exclude,0.98,1.0,E2,E2,"This is a quantitative educational continuance-intention study using PLS with likely reportable path coefficients, but the focal technology is weblogs/blogs rather than AI. Because AI is not the central technology, it should be excluded.","The study focuses on weblogs, not Artificial Intelligence (AI) technology, failing to meet the criterion that AI technology must be focal. It is an empirical quantitative study in an educational context measuring continuance usage intention.",exclude,oauth,oauth,,,,,,
REC_10235,Mexican female university students and entrepreneurial intention. An approach from the theory of planned action.,2024,WoS,exclude,exclude,0.99,1.0,E2,E2,"This is a quantitative study in a university student sample, but it examines entrepreneurial intention via Theory of Planned Behavior, not AI technology adoption/acceptance/use. Therefore it does not meet the core AI-focal and AI-adoption outcome criteria.",The study investigates entrepreneurial intention using the Theory of Planned Behavior among university students but does not involve AI technology. AI technology must be focal for inclusion.,exclude,oauth,oauth,,,,,,
REC_10262,Determining Factors Influencing Indonesian Higher Education Students' Intention to Adopt Artificial Intelligence Tools for Self-Directed Learning Management,2025,Scopus,uncertain,include,0.72,0.9,NA,NA,"This is a quantitative survey of higher-education students focused on intention to adopt AI tools, so core topical criteria are met. However, the abstract emphasizes ANN predictive accuracy and factor importance rather than clearly reporting correlation matrices or standardized beta/path coefficients, so effect-size extractability is uncertain.","The study is an empirical quantitative analysis of higher education students' intention to adopt AIED tools, published in 2025. It reports on factors influencing intention, implying derivable effect sizes.",conflict,oauth,oauth,,,,,,
REC_10276,The relationship between burnout and engagement with the self-efficacy and self-regulation of college students in distance courses,2023,WoS,exclude,exclude,0.99,1.0,E3,E2,"This is a quantitative SEM study in higher education, but the focal constructs are burnout, self-efficacy, engagement, and self-regulation rather than AI technology. It does not measure AI adoption/acceptance/intention/use outcomes required for this meta-analysis.","The study focuses on burnout and psychological factors in distance education, not on AI technology or its adoption, acceptance, intention, or use.",exclude,oauth,oauth,,,,,,
REC_10410,Autonomous and informed decision-making: The case of colorectal cancer screening,2020,PsycINFO,exclude,exclude,0.99,1.0,E2,E2,"This is a qualitative health study (semi-structured interviews about colorectal cancer screening decisions), not an empirical quantitative study of AI adoption. It is outside the educational AI adoption scope and does not provide correlation/path-effect data relevant to the meta-analysis.","This is a qualitative study on medical decision-making for cancer screening, not a quantitative study about AI adoption in an educational context.",exclude,oauth,oauth,,,,,,
REC_10797,Exploring the Impact of E-Learning Initiatives on Students' Self-Efficacy and E-Learning Experiences,2024,WoS; Scopus,exclude,exclude,0.96,0.95,E2,E2,"This is a quantitative student survey in education (2024, English), but the focal technology is general e-learning rather than AI. The outcomes center on self-efficacy and e-learning experiences, not AI adoption/acceptance/intention/use.","The study focuses on general 'E-learning' and does not specify any AI-driven tools or technologies. The core topic is self-efficacy in a broad online learning context, making it out of scope.",exclude,oauth,oauth,,,,,,
REC_10933,THE ACADEMY AGAINST THE POST-CONFLICT AND PEACE. CASE STUDY,2018,WoS,exclude,uncertain,0.97,0.0,E2,NA,"Although this is a quantitative survey in a university student sample, the focal topic is peace/conflict knowledge and perceptions rather than AI technology. It also does not measure AI adoption/acceptance/use outcomes or report likely extractable effect-size data for AI adoption meta-analysis.",Failed to parse JSON from gemini: Expecting property name enclosed in double quotes: line 10 column 1 (char 205),conflict,oauth,oauth,,,,,,
REC_11628,Investigating the State of Self-Expression and its Relationship with Adjustment and Self-Efficacy of Students: Evidence From a Cross-sectional Study in Southern Iran,2024,Scopus,exclude,exclude,0.99,1.0,E2,E2,"This is a quantitative student study in an educational setting, but it examines self-expression, adjustment, and self-efficacy rather than AI technology. It also does not measure AI adoption/acceptance/intention/use outcomes required for this meta-analysis.","The study investigates psychological constructs like self-expression and self-efficacy, but it is not focused on AI technology, which is a primary inclusion criterion.",exclude,oauth,oauth,,,,,,
